{
  "submittedOn": "2020-07-06T09:37:17Z",
  "lifeInsurance": [
    {
      "customerReference": "INPOLY123A",
      "event": "Policy matured",
      "gainAmount": 1000.23,
      "taxPaid": true,
      "yearsHeld": 10,
      "yearsHeldSinceLastGain": 1,
      "deficiencyRelief": 100.23
    }
  ],
  "capitalRedemption": [
    {
      "customerReference": "INPOLY123B",
      "event": "Policy matured",
      "gainAmount": 1000.23,
      "taxPaid": true,
      "yearsHeld": 10,
      "yearsHeldSinceLastGain": 1,
      "deficiencyRelief": 100.23
    }
  ],
  "lifeAnnuity": [
    {
      "customerReference": "INPOLY123C",
      "event": "Policy matured",
      "gainAmount": 1000.23,
      "taxPaid": true,
      "yearsHeld": 10,
      "yearsHeldSinceLastGain": 1,
      "deficiencyRelief": 100.23
    }
  ],
  "voidedIsa": [
    {
      "customerReference": "INPOLY123D",
      "event": "Policy matured",
      "gainAmount": 1000.23,
      "taxPaidAmount": 100.23,
      "yearsHeld": 10,
      "yearsHeldSinceLastGain": 1
    }
  ],
  "foreign": [
    {
      "customerReference": "INPOLY123E",
      "gainAmount": 1000.23,
      "taxPaidAmount": 100.23,
      "yearsHeld": 10
    }
  ],
  "links": [
    {
      "href": "/individuals/income-received/insurance-policies/TC663795B/2021-22",
      "rel": "create-and-amend-insurance-policies-income",
      "method": "PUT"
    },
    {
      "href": "/individuals/income-received/insurance-policies/TC663795B/2021-22",
      "rel": "self",
      "method": "GET"
    },
    {
      "href": "/individuals/income-received/insurance-policies/TC663795B/2021-22",
      "rel": "delete-insurance-policies-income",
      "method": "DELETE"
    }
  ]
}